id_colaborador,comentarios_soft_skills,avaliacao_pessoal_texto,data
1,"Excelente comunicação e liderança natural.","Promissora para cargos de diretoria.",2024-03-01
2,"Ótimo tecnicamente, mas precisa melhorar oratória.","Consistente no desempenho técnico.",2024-03-05
3,"Muito reservada, precisa de mais proatividade em reuniões.","Risco de estagnação por falta de visibilidade.",2024-03-10
4,"Foco total em processos, às vezes esquece o lado humano.","Líder operacional eficiente.",2024-03-12
5,"Criativa e ágil, mas tem dificuldade com prazos longos.","Grande potencial criativo.",2024-03-15
